//UC1: Ability to Create a payroll service database

Enter password: ***********
Welcome to the MySQL monitor.  Commands end with ; or \g.
Your MySQL connection id is 15
Server version: 8.0.31 MySQL Community Server - GPL

Copyright (c) 2000, 2022, Oracle and/or its affiliates.

Oracle is a registered trademark of Oracle Corporation and/or its
affiliates. Other names may be trademarks of their respective
owners.

Type 'help;' or '\h' for help. Type '\c' to clear the current input statement.

mysql> show databases;
+---------------------------+
| Database                  |
+---------------------------+
| address_book_system       |
| addressbookservice        |
| addressbooksystem         |
| blz                       |
| employee_payroll_service  |
| employee_payroll_services |
| information_schema        |
| mysql                     |
| payroll_service           |
| payroll_services          |
| performance_schema        |
| sys                       |
+---------------------------+
12 rows in set (0.01 sec)

mysql> use employee_payroll_service;
Database changed

********************************************************************

//UC2: Ability to create a employee payroll table
in the payroll service database to
manage employee payrolls


mysql> use employee_payroll_service;
Database changed
mysql> create table employee_payroll(id int auto_increment,name varchar(30),salary double,start_date date,primary key(id));
Query OK, 0 rows affected (0.19 sec)
***********************************************************************

//UC3: Ability to create employee payroll data in the payroll service database as part of CURD Operation


mysql> insert into employee_payroll(name,salary,start_date)values('Bill',1000000.0,'2018-01-03'),('Mark',2000000.0,'2019-11-13'),('Clarlie',3000000,'2020-05-21');
Query OK, 3 rows affected (0.03 sec)
Records: 3  Duplicates: 0  Warnings: 0

***********************************************************************

//UC4: Ability to retrieve all the employee payroll data that is added to payroll service database

mysql> select *from employee_payroll;
+----+---------+---------+------------+
| id | name    | salary  | start_date |
+----+---------+---------+------------+
|  1 | Bill    | 1000000 | 2018-01-03 |
|  2 | Mark    | 2000000 | 2019-11-13 |
|  3 | Clarlie | 3000000 | 2020-05-21 |
+----+---------+---------+------------+
3 rows in set (0.00 sec)

*************************************************************************

//UC5: Ability to retrieve salary data for a particular employee as well as all employees who have joined in a particular data range from the payroll service database

mysql> select salary from employee_payroll where name = 'Bill';
+---------+
| salary  |
+---------+
| 1000000 |
+---------+
1 row in set (0.00 sec)

mysql> select start_date from employee_payroll where start_date between cast('2018-01-01' as date) and date(now());
+------------+
| start_date |
+------------+
| 2018-01-03 |
| 2019-11-13 |
| 2020-05-21 |
+------------+
3 rows in set (0.01 sec)

***************************************************************************

UC6:  Ability to add Gender to Employee Payroll Table and Update the Rows to reflect the correct Employee Gender

mysql> update employee_payroll set gender = 'M' where name = 'Charlie';
Query OK, 0 rows affected (0.00 sec)
Rows matched: 0  Changed: 0  Warnings: 0

mysql> select * from employee_payroll;
+----+---------+--------+---------+------------+
| id | name    | gender | salary  | start_date |
+----+---------+--------+---------+------------+
|  1 | Bill    | M      | 1000000 | 2018-01-03 |
|  2 | Mark    | NULL   | 2000000 | 2019-11-13 |
|  3 | Clarlie | NULL   | 3000000 | 2020-05-21 |
+----+---------+--------+---------+------------+
3 rows in set (0.00 sec)

mysql> update employee_payroll set gender = 'M' where name = 'Clarlie';
Query OK, 1 row affected (0.01 sec)
Rows matched: 1  Changed: 1  Warnings: 0

mysql> select * from employee_payroll;
+----+---------+--------+---------+------------+
| id | name    | gender | salary  | start_date |
+----+---------+--------+---------+------------+
|  1 | Bill    | M      | 1000000 | 2018-01-03 |
|  2 | Mark    | NULL   | 2000000 | 2019-11-13 |
|  3 | Clarlie | M      | 3000000 | 2020-05-21 |
+----+---------+--------+---------+------------+
3 rows in set (0.00 sec)

mysql> update employee_payroll set gender = 'F' where name = 'Mark';
Query OK, 1 row affected (0.01 sec)
Rows matched: 1  Changed: 1  Warnings: 0

mysql> select * from employee_payroll;
+----+---------+--------+---------+------------+
| id | name    | gender | salary  | start_date |
+----+---------+--------+---------+------------+
|  1 | Bill    | M      | 1000000 | 2018-01-03 |
|  2 | Mark    | F      | 2000000 | 2019-11-13 |
|  3 | Clarlie | M      | 3000000 | 2020-05-21 |
+----+---------+--------+---------+------------+
3 rows in set (0.00 sec)

*************************************************************************************

//UC7: Ability to find sum, average, min, max and number of male and female employees


mysql> select sum(salary) from employee_payroll where gender ='M' group by gender;
+-------------+
| sum(salary) |
+-------------+
|     4000000 |
+-------------+
1 row in set (0.00 sec)

mysql> select avg(salary) from employee_payroll where gender ='M' group by gender;
+-------------+
| avg(salary) |
+-------------+
|     2000000 |
+-------------+
1 row in set (0.01 sec)

mysql> select min(salary) from employee_payroll where gender ='M' group by gender;
+-------------+
| min(salary) |
+-------------+
|     1000000 |
+-------------+
1 row in set (0.01 sec)

mysql> select max(salary) from employee_payroll where gender ='M' group by gender;
+-------------+
| max(salary) |
+-------------+
|     3000000 |
+-------------+
1 row in set (0.00 sec)

mysql> select count(salary) from employee_payroll where gender ='M' group by gender;
+---------------+
| count(salary) |
+---------------+
|             2 |
+---------------+
1 row in set (0.00 sec)

mysql> select count(salary) from employee_payroll where gender ='F' group by gender;
+---------------+
| count(salary) |
+---------------+
|             1 |
+---------------+
1 row in set (0.00 sec)

***********************************************************************************************

//UC8: Ability to extend employee_payroll data to store employee information like employee phone, address and department - Ensure employee department


mysql> use employee_payroll_service;
Database changed
mysql> select * from employee_payroll;
+----+---------+--------+---------+------------+
| id | name    | gender | salary  | start_date |
+----+---------+--------+---------+------------+
|  1 | Bill    | M      | 1000000 | 2018-01-03 |
|  2 | Mark    | F      | 2000000 | 2019-11-13 |
|  3 | Clarlie | M      | 3000000 | 2020-05-21 |
+----+---------+--------+---------+------------+
3 rows in set (0.00 sec)

mysql> alter table employee_payroll add phone_number varchar(250) after name;
Query OK, 0 rows affected (0.01 sec)
Records: 0  Duplicates: 0  Warnings: 0

mysql> alter table employee_payroll add address varchar(50) after phone_number;
Query OK, 0 rows affected (0.01 sec)
Records: 0  Duplicates: 0  Warnings: 0

mysql> alter table employee_payroll add departmant varchar(100) not null after address;
Query OK, 0 rows affected (0.01 sec)
Records: 0  Duplicates: 0  Warnings: 0

mysql> select * from employee_payroll;
+----+---------+--------------+---------+------------+--------+---------+------------+
| id | name    | phone_number | address | departmant | gender | salary  | start_date |
+----+---------+--------------+---------+------------+--------+---------+------------+
|  1 | Bill    | NULL         | NULL    |            | M      | 1000000 | 2018-01-03 |
|  2 | Mark    | NULL         | NULL    |            | F      | 2000000 | 2019-11-13 |
|  3 | Clarlie | NULL         | NULL    |            | M      | 3000000 | 2020-05-21 |
+----+---------+--------------+---------+------------+--------+---------+------------+
3 rows in set (0.00 sec)

**********************************************************************************************

//UC9: Ability to extend employee_payroll table to have Basic Pay,Deductions, Taxable Pay,Income Tax, Net Pay


mysql> alter table employee_payroll add dedection double not null after basic_pay;
Query OK, 0 rows affected (0.02 sec)
Records: 0  Duplicates: 0  Warnings: 0

mysql> alter table employee_payroll add taxable_pay double not null after deduction;
ERROR 1054 (42S22): Unknown column 'deduction' in 'employee_payroll'
mysql> alter table employee_payroll add taxable_pay double not null after dedection;
Query OK, 0 rows affected (0.01 sec)
Records: 0  Duplicates: 0  Warnings: 0

mysql> alter table employee_payroll add tax double not null after taxable_pay;
Query OK, 0 rows affected (0.02 sec)
Records: 0  Duplicates: 0  Warnings: 0

mysql> alter table employee_payroll add net_pay double not null after tax;
Query OK, 0 rows affected (0.01 sec)
Records: 0  Duplicates: 0  Warnings: 0

mysql> alter table employee_payroll rename column dedection to deduction;
Query OK, 0 rows affected (0.01 sec)
Records: 0  Duplicates: 0  Warnings: 0

mysql> select * from employee_payroll;
+----+---------+--------------+---------+------------+--------+-----------+-----------+-------------+-----+---------+------------+
| id | name    | phone_number | address | departmant | gender | basic_pay | deduction | taxable_pay | tax | net_pay | start_date |
+----+---------+--------------+---------+------------+--------+-----------+-----------+-------------+-----+---------+------------+
|  1 | Bill    | NULL         | NULL    |            | M      |   1000000 |         0 |           0 |   0 |       0 | 2018-01-03 |
|  2 | Mark    | NULL         | NULL    |            | F      |   2000000 |         0 |           0 |   0 |       0 | 2019-11-13 |
|  3 | Clarlie | NULL         | NULL    |            | M      |   3000000 |         0 |           0 |   0 |       0 | 2020-05-21 |
+----+---------+--------------+---------+------------+--------+-----------+-----------+-------------+-----+---------+------------+
3 rows in set (0.00 sec)

********************************************************************************************************************

//UC10: Ability to make Terissa as part of Sales and Marketing Department

mysql> insert into employee_payroll(name,phone_number,address,departmant,gender,basic_pay,deduction,taxable_pay,tax,net_pay,start_date)values('Terssia','NULL','NULL','Marketing','F','3000000','1000000','2000000','5000000','15000000','2018-01-03');
Query OK, 1 row affected (0.01 sec)

mysql> select * from employee_payroll;
+----+---------+--------------+---------+------------+--------+-----------+-----------+-------------+---------+----------+------------+
| id | name    | phone_number | address | departmant | gender | basic_pay | deduction | taxable_pay | tax     | net_pay  | start_date |
+----+---------+--------------+---------+------------+--------+-----------+-----------+-------------+---------+----------+------------+
|  1 | Bill    | NULL         | NULL    |            | M      |   1000000 |         0 |           0 |       0 |        0 | 2018-01-03 |
|  2 | Terissa | NULL         | NULL    | Sales      | F      |   2000000 |         0 |           0 |       0 |        0 | 2019-11-13 |
|  3 | Clarlie | NULL         | NULL    |            | M      |   3000000 |         0 |           0 |       0 |        0 | 2020-05-21 |
|  4 | Terssia | NULL         | NULL    | Marketing  | F      |   3000000 |   1000000 |     2000000 | 5000000 | 15000000 | 2018-01-03 |
+----+---------+--------------+---------+------------+--------+-----------+-----------+-------------+---------+----------+------------+
4 rows in set (0.00 sec)

*********************************************************************************************************************

//UC11:

mysql> create table employee(
    -> company_ID int not null,
    -> company_name varchar(30) not null,
    -> primary key(company_ID));
Query OK, 0 rows affected (0.02 sec)

mysql> desc company;
ERROR 1146 (42S02): Table 'employee_payroll_service.company' doesn't exist
mysql> desc employee;
+--------------+-------------+------+-----+---------+-------+
| Field        | Type        | Null | Key | Default | Extra |
+--------------+-------------+------+-----+---------+-------+
| company_ID   | int         | NO   | PRI | NULL    |       |
| company_name | varchar(30) | NO   |     | NULL    |       |
+--------------+-------------+------+-----+---------+-------+
2 rows in set (0.01 sec)

mysql> create table employeeInfo(
    -> id int unsigned not null auto_increment,
    -> name varchar(30) not null,
    -> salary double not null,
    -> company_ID int not null,
    -> foreign key(company_ID) references employee(company_ID),
    -> primary key(id));
Query OK, 0 rows affected (0.03 sec)

mysql> select * from employeeInfo;
Empty set (0.00 sec)

mysql> desc employeeInfo;
+------------+--------------+------+-----+---------+----------------+
| Field      | Type         | Null | Key | Default | Extra          |
+------------+--------------+------+-----+---------+----------------+
| id         | int unsigned | NO   | PRI | NULL    | auto_increment |
| name       | varchar(30)  | NO   |     | NULL    |                |
| salary     | double       | NO   |     | NULL    |                |
| company_ID | int          | NO   | MUL | NULL    |                |
+------------+--------------+------+-----+---------+----------------+
4 rows in set (0.00 sec)

******************************************************************************************************************************